{
  "schema": "credential-eval/performance-config/v1",
  "baseline": {
    "id": "__BASELINE_ID__",
    "version": "__BASELINE_VERSION__",
    "revision": "__BASELINE_REVISION__",
    "program": "__BASELINE_BIN__",
    "args": [],
    "delivery": "stdin",
    "ok_exit_codes": [
      0,
      1
    ]
  },
  "candidate": {
    "id": "__CANDIDATE_ID__",
    "version": "__CANDIDATE_VERSION__",
    "revision": "__CANDIDATE_REVISION__",
    "program": "__CANDIDATE_BIN__",
    "args": [],
    "delivery": "stdin",
    "ok_exit_codes": [
      0,
      1
    ]
  },
  "workloads": [
    {
      "id": "sparse-unicode",
      "units": 1700
    },
    {
      "id": "dense-unicode",
      "units": 1700
    },
    {
      "id": "sparse-invisible",
      "units": 2000
    },
    {
      "id": "dense-invisible",
      "units": 4000
    },
    {
      "id": "overlap-clusters",
      "units": 2000
    },
    {
      "id": "seam-heavy",
      "units": 1000
    },
    {
      "id": "repeated-short-log-lines",
      "units": 5000
    },
    {
      "id": "long-single-line-assignments",
      "units": 5
    },
    {
      "id": "dense-early-exhaustion",
      "units": 500
    },
    {
      "id": "assignments-ordinary",
      "units": 1000
    },
    {
      "id": "azure-repeated-records",
      "units": 100
    },
    {
      "id": "azure-duplicate-keys",
      "units": 100
    },
    {
      "id": "overlap-sparse",
      "units": 1000
    },
    {
      "id": "overlap-pairs",
      "units": 1000
    },
    {
      "id": "overlap-dense",
      "units": 1000
    }
  ],
  "shapes": [
    "whole",
    "chunked"
  ],
  "chunk_bytes": 65536,
  "rounds": 15,
  "batch_invocations": 5,
  "warmup_invocations": 3,
  "limits": {
    "timeout_ms": 30000,
    "max_input_bytes": 8388608,
    "max_response_bytes": 16777216,
    "max_diagnostic_bytes": 1048576
  },
  "toolchain": [
    {
      "name": "llvm",
      "version": "__LLVM_VERSION__"
    },
    {
      "name": "rustc",
      "version": "__RUSTC_VERSION__"
    }
  ]
}
